{
  "schema_version": 1,
  "run_id": "module1-bootstrap",
  "source": {
    "commit_sha": "cb433df7ec00397448e169777952de838afa5bfe",
    "branch": "main"
  },
  "collection_status": "initialized",
  "modules": {
    "backend": {
      "status": "not_available",
      "metrics": {}
    },
    "frontend": {
      "status": "not_available",
      "metrics": {}
    }
  },
  "delta": {}
}
